{
  "track_id": "supermarket_health_pilot_20260718",
  "type": "research",
  "phase": "Applications",
  "status": "active",
  "created_at": "2026-07-18T01:30:00Z",
  "updated_at": "2026-08-25T18:30:00Z",
  "description": "Reproduce and extend supermarket density/access analysis with open code, multi-source facilities, zoning feasibility, health outcomes, causal restraint and transparent location alternatives.",
  "depends_on": [
    "planning_rules_linkage_20260718",
    "accessibility_network_engine_20260719",
    "facility_registry_20260719",
    "facility_location_engine_20260718",
    "health_outcomes_causal_methods_20260719"
  ],
  "github_issue": "https://github.com/edithatogo/riopa-infrastructure/issues/109",
  "evidence": [
    "urn:riopa:evidence:supermarket-density-reference:2026-08-25",
    "urn:riopa:evidence:supermarket-preregistration:2026-08-25",
    "urn:riopa:evidence:supermarket-reference-comparison:2026-08-25",
    "urn:riopa:evidence:supermarket-conductor-regeneration:2026-08-25",
    "urn:riopa:evidence:supermarket-integrated-reference-core:2026-08-25",
    "urn:riopa:evidence:wp010-single-developer-closeout:2026-08-29"
  ],
  "target_release": "0.8.0",
  "owner_repository": "edithatogo/riopa-infrastructure",
  "v1_critical": true,
  "maturity_target": "M6",
  "maturity_dimensions": [
    "data",
    "publication",
    "analytics",
    "science"
  ],
  "stability_class": "Reference",
  "risk": "High",
  "priority": "P1",
  "mirror_to_umbrella": true,
  "current_maturity": "M1",
  "owner_role": "Research lead",
  "review_roles": [
    "Data-governance analyst",
    "Research-object analyst",
    "Quantitative methods analyst",
    "Scientific-methods analyst"
  ],
  "blocking_defects": [
    "All five dependency tracks remain incomplete at M1.",
    "Rights-cleared versioned supermarket and population inputs and factual baseline reproduction are unavailable.",
    "Representative access, facility reconciliation, empirical ecological-health and sensitivity analyses are incomplete.",
    "Operative planning linkage, authority review and representative solver alternatives are incomplete.",
    "Agent-panel qualification, complete research object, independent reproduction, publication and release authority are incomplete."
  ]
}
