{
  "track_id": "accessibility_network_engine_20260719",
  "type": "analytics",
  "phase": "Analytics",
  "status": "specified",
  "created_at": "2026-07-19T00:00:00Z",
  "updated_at": "2026-07-19T00:00:00Z",
  "description": "Provide reusable, versioned and benchmarked travel matrices and accessibility measures for walking, cycling, driving, public transport and capacity-aware service access.",
  "depends_on": [
    "canonical_domain_schemas_ontology_20260719",
    "provenance_profile_v1_20260718"
  ],
  "github_issue": "https://github.com/edithatogo/riopa-infrastructure/issues/54",
  "evidence": [],
  "target_release": "0.6.0",
  "owner_repository": "edithatogo/riopa-infrastructure",
  "v1_critical": true,
  "maturity_target": "M6",
  "maturity_dimensions": [
    "contracts",
    "data",
    "analytics",
    "science"
  ],
  "stability_class": "Platform",
  "risk": "High",
  "priority": "P1",
  "mirror_to_umbrella": true,
  "current_maturity": "M1",
  "owner_role": "Methods and analytics lead",
  "review_roles": [
    "API/schema analyst",
    "Data-governance analyst",
    "Quantitative methods analyst",
    "Scientific-methods analyst"
  ],
  "blocking_defects": []
}
