{
  "track_id": "spatial_quality_temporality_20260718",
  "type": "analytics",
  "phase": "NZ Spatial",
  "status": "active",
  "created_at": "2026-07-18T01:30:00Z",
  "updated_at": "2026-08-24T21:35:00Z",
  "description": "Make geometry, topology, completeness, positional, temporal and semantic quality measurable and support defensible historical, boundary and change analyses.",
  "depends_on": [
    "nz_spatial_archive_mvp_20260718",
    "planning_rules_linkage_20260718",
    "provenance_query_api_20260719"
  ],
  "github_issue": "https://github.com/edithatogo/riopa-infrastructure/issues/89",
  "evidence": [
    "urn:riopa:evidence:feature-snapshot-differences:2026-07-31",
    "urn:riopa:evidence:spatial-quality-profile:2026-08-25",
    "urn:riopa:evidence:spatial-quality-evaluator:2026-08-25"
    ,"urn:riopa:evidence:spatial-quality-trend:2026-08-25"
    ,"urn:riopa:evidence:spatial-temporal-query:2026-08-25"
    ,"urn:riopa:evidence:spatial-quality-change-attribution:2026-08-25"
    ,"urn:riopa:evidence:spatial-temporal-history-audit:2026-08-25"
    ,"urn:riopa:evidence:spatial-boundary-crosswalk:2026-08-25"
  ],
  "target_release": "0.7.0",
  "owner_repository": "edithatogo/riopa-infrastructure",
  "v1_critical": true,
  "maturity_target": "M6",
  "maturity_dimensions": [
    "provenance",
    "data",
    "analytics",
    "science"
  ],
  "stability_class": "Reference",
  "risk": "High",
  "priority": "P1",
  "mirror_to_umbrella": true,
  "current_maturity": "M1",
  "owner_role": "Spatial data lead",
  "review_roles": [
    "Provenance analyst",
    "Data-governance analyst",
    "Quantitative methods analyst",
    "Scientific-methods analyst"
  ],
  "blocking_defects": []
}
