{
  "track_id": "governance_maori_data_sovereignty_20260718",
  "type": "governance",
  "phase": "Foundation",
  "status": "specified",
  "created_at": "2026-07-18T01:30:00Z",
  "updated_at": "2026-07-19T00:00:00Z",
  "description": "Embed lawful reuse, social licence, benefit, M\u0101ori rights, privacy, safety and withdrawal decisions into source registration, analysis and publication gates.",
  "depends_on": [
    "foundation_architecture_20260718"
  ],
  "github_issue": "https://github.com/edithatogo/riopa-infrastructure/issues/19",
  "evidence": [],
  "target_release": "0.3.0",
  "owner_repository": "edithatogo/riopa-infrastructure",
  "v1_critical": true,
  "maturity_target": "M6",
  "maturity_dimensions": [
    "governance",
    "security",
    "data",
    "science"
  ],
  "stability_class": "Governance",
  "risk": "Critical",
  "priority": "P0",
  "mirror_to_umbrella": true,
  "current_maturity": "M1",
  "owner_role": "Programme owner",
  "review_roles": [
    "Governance reviewer",
    "Security reviewer",
    "Data steward",
    "Scientific reviewer"
  ],
  "blocking_defects": []
}
