{
  "track_id": "simulation_validation_engine_20260719",
  "type": "analytics",
  "phase": "Analytics",
  "status": "specified",
  "created_at": "2026-07-19T00:00:00Z",
  "updated_at": "2026-08-22T00:00:00Z",
  "description": "Provide reproducible discrete-event and dispatch simulation for systems where availability, queueing, congestion, handover or dynamic relocation invalidate static location models.",
  "depends_on": [
    "canonical_domain_schemas_ontology_20260719",
    "facility_location_engine_20260718"
  ],
  "github_issue": "https://github.com/edithatogo/riopa-infrastructure/issues/94",
  "evidence": [],
  "target_release": "0.8.0",
  "owner_repository": "edithatogo/riopa-infrastructure",
  "v1_critical": true,
  "maturity_target": "M6",
  "maturity_dimensions": [
    "provenance",
    "operations",
    "analytics",
    "science"
  ],
  "stability_class": "Platform",
  "risk": "Critical",
  "priority": "P1",
  "mirror_to_umbrella": true,
  "current_maturity": "M1",
  "owner_role": "Methods and analytics lead",
  "review_roles": [
    "Provenance analyst",
    "Operations analyst",
    "Quantitative methods analyst",
    "Scientific-methods analyst"
  ],
  "blocking_defects": []
}
