{
  "track_id": "bounded_roadmap_technical_preview_release_20260826",
  "type": "release",
  "phase": "Release",
  "status": "archived",
  "created_at": "2026-08-25T14:46:02Z",
  "updated_at": "2026-08-25T15:27:39Z",
  "description": "Published and archived the reconstructed v0.2.0 M1 roadmap snapshot as a bounded, attested and supported technical preview without changing later tracks.",
  "depends_on": [],
  "github_issue": "https://github.com/edithatogo/riopa-infrastructure/issues/604",
  "evidence": [
    "https://github.com/edithatogo/riopa-infrastructure/releases/tag/v0.2.0",
    "https://github.com/edithatogo/riopa-infrastructure/actions/runs/32865862594",
    "urn:riopa:decision:v0.2.0-bounded-technical-preview:2026-08-26",
    "urn:riopa:evidence:v0.2.0-closeout:2026-08-26",
    "https://github.com/edithatogo/riopa-infrastructure/issues/605"
  ],
  "target_release": "0.2.0",
  "owner_repository": "edithatogo/riopa-infrastructure",
  "owner_role": "Repository owner",
  "review_roles": [
    "Release analyst",
    "Supply-chain analyst",
    "Governance analyst"
  ],
  "v1_critical": false,
  "current_maturity": "M1",
  "maturity_target": "M1",
  "maturity_dimensions": [
    "governance",
    "security",
    "publication"
  ],
  "stability_class": "Governance",
  "risk": "Medium",
  "priority": "P0",
  "mirror_to_umbrella": false,
  "blocking_defects": []
}
