{
  "track_id": "interoperability_conformance_sdks_20260719",
  "type": "platform",
  "phase": "Core",
  "status": "complete",
  "created_at": "2026-07-19T00:00:00Z",
  "updated_at": "2026-07-31T08:30:44Z",
  "description": "Prove cross-language and standards interoperability through normative fixtures, conformance runners, compatibility matrices and supported Python, Rust and API client surfaces.",
  "depends_on": [
    "provenance_profile_v1_20260718",
    "canonical_domain_schemas_ontology_20260719",
    "methods_research_objects_20260718",
    "repository_template_adoption_20260718"
  ],
  "github_issue": "https://github.com/edithatogo/riopa-infrastructure/issues/64",
  "evidence": [
    "urn:riopa:evidence:python-node-conformance-corpus:2026-07-31"
  ],
  "target_release": "0.6.0",
  "owner_repository": "edithatogo/riopa-infrastructure",
  "owner_role": "Core platform maintainer",
  "review_roles": [
    "API/schema reviewer",
    "Provenance reviewer",
    "Interoperability reviewer",
    "External user reviewer",
    "Research-object reviewer"
  ],
  "v1_critical": true,
  "current_maturity": "M1",
  "maturity_target": "M6",
  "maturity_dimensions": [
    "contracts",
    "provenance",
    "interoperability",
    "usability",
    "publication"
  ],
  "stability_class": "Platform",
  "risk": "High",
  "priority": "P0",
  "mirror_to_umbrella": true,
  "blocking_defects": []
}