{
  "track_id": "canonical_domain_schemas_ontology_20260719",
  "type": "specification",
  "phase": "Core",
  "status": "specified",
  "created_at": "2026-07-19T00:00:00Z",
  "updated_at": "2026-07-19T00:00:00Z",
  "description": "Define stable, versioned identities and semantics for authorities, services, plans, provisions, spatial features, facilities, assertions, mappings and analytical runs.",
  "depends_on": [
    "foundation_architecture_20260718",
    "governance_maori_data_sovereignty_20260718"
  ],
  "github_issue": null,
  "evidence": [],
  "target_release": "0.3.0",
  "owner_repository": "edithatogo/riopa-infrastructure",
  "v1_critical": true,
  "maturity_target": "M6",
  "maturity_dimensions": [
    "governance",
    "contracts",
    "data",
    "usability"
  ],
  "stability_class": "Normative",
  "risk": "High",
  "priority": "P0",
  "mirror_to_umbrella": true,
  "current_maturity": "M1",
  "owner_role": "Core platform maintainer",
  "review_roles": [
    "Governance reviewer",
    "API/schema reviewer",
    "Data steward",
    "External user reviewer"
  ],
  "blocking_defects": []
}
